menu_id,category,menu,menu_th,menu_cn,menu_jp,price,cost,calories,ingredient,description,description_th
B1,bakery,Muffin,มัฟฟิน,玛芬,マフィン,60,27,300,"Flour, Sugar, Eggs, Milk","Freshly baked muffins, available in blueberry, chocolate chip, and banana nut, perfect for a sweet treat any time of day.",มัฟฟินอบสดใหม่มีให้เลือกทั้งบลูเบอร์รี่ ช็อกโกแลตชิป และกล้วยถั่ว เหมาะสําหรับขนมหวานตลอดเวลาของวัน
B2,bakery,Donut,โดนัท,甜甜圈,ドーナツ,40,12,250,"Flour, Sugar, Yeast, Milk","Freshly baked donuts, glazed or filled, with a variety of flavors to satisfy your sweet cravings.",โดนัทอบสดใหม่เคลือบหรือไส้ด้วยรสชาติที่หลากหลายเพื่อตอบสนองความอยากหวานของคุณ
B3,bakery,Sandwich,แซนด์วิช,三明治,サンドイッチ,80,28,300,"Bread, Lettuce, Tomato, Turkey","Freshly made sandwiches with artisanal bread, premium meats, and local veggies, perfect for a quick, delicious meal on the go.",แซนวิชที่ทําสดใหม่พร้อมขนมปังฝีมือ เนื้อสัตว์ระดับพรีเมียม และผักท้องถิ่น เหมาะสําหรับมื้ออาหารแสนอร่อยอย่างรวดเร็วระหว่างเดินทาง
B4,bakery,Cheese Cake,ชีสเค้ก,芝士蛋糕,チーズケーキ,120,78,250-400 calories per slice.,"Cream cheese, Sugar, Eggs, Graham cracker crust","Rich and creamy cheesecake with a buttery graham cracker crust, topped with seasonal fruit or chocolate drizzle. Indulge today!",ชีสเค้กเข้มข้นและครีมพร้อมแป้งแครกเกอร์เกรแฮมเนย ราดด้วยผลไม้ตามฤดูกาลหรือช็อกโกแลตฝนตกปรอยๆ ดื่มด่ําวันนี้!
B5,bakery,Croissant,ครัวซองต์,可颂,クロワッサン,85,46,231,"Flour, Butter, Yeast, Salt","Flaky, buttery croissant baked fresh daily, perfect for a delightful breakfast or snack. Enjoy plain or with your choice of filling!",ครัวซองต์เนยเป็นขุยอบสดใหม่ทุกวัน เหมาะสําหรับอาหารเช้าหรือของว่างแสนอร่อย เพลิดเพลินไปกับแบบธรรมดาหรือไส้ที่คุณเลือก!
B6,bakery,Cookies,คุกกี้,饼干,クッキー,85,42,"150-200 calories per cookie, depending on size and ingredients.","Flour, Sugar, Butter, Chocolate Chips","Freshly baked cookies, featuring classic chocolate chip, oatmeal raisin, and seasonal flavors, perfect for pairing with your favorite coffee.",คุกกี้อบสดใหม่ประกอบด้วยช็อกโกแลตชิปคลาสสิกลูกเกดข้าวโอ๊ตและรสชาติตามฤดูกาลเหมาะสําหรับจับคู่กับกาแฟที่คุณชื่นชอบ
C6,coffee,Americano,อเมริกาโน,美式咖啡,アメリカーノ,45,22,15,"Espresso, Hot Water","Rich espresso diluted with hot water, offering a smooth, bold flavor perfect for coffee lovers.",เอสเพรสโซ่เข้มข้นเจือจางด้วยน้ําร้อน ให้รสชาติที่นุ่มนวลและเข้มข้นเหมาะสําหรับคนรักกาแฟ
C7,coffee,Cappuccino,คาปูชิโน่,卡布奇诺,カプチーノ,75,36,120,"Espresso, Steamed milk, Milk foam","Rich espresso topped with velvety steamed milk and a light dusting of cocoa, perfect for a cozy coffee break.",เอสเพรสโซ่เข้มข้นราดด้วยนมนึ่งนุ่มนวลและโรยโกโก้เบา ๆ เหมาะสําหรับการพักดื่มกาแฟแสนสบาย
C8,coffee,Espresso,เอสเพรสโซ่,浓缩咖啡,エスプレッソ,55,26,1 calorie,"Espresso Beans, Water","Rich, bold espresso made from freshly ground beans, delivering a perfect shot of energy and flavor in every cup.",เอสเพรสโซ่เข้มข้นเข้มข้นที่ทําจากเมล็ดกาแฟบดสด ให้พลังงานและรสชาติที่สมบูรณ์แบบในทุกถ้วย
C9,coffee,Mocha,มอคค่า,摩卡,モカ,70,35,350,"Espresso, Steamed Milk, Chocolate Syrup, Whipped Cream","Rich espresso blended with steamed milk and velvety chocolate, topped with whipped cream for a delightful treat.",เอสเพรสโซ่เข้มข้นผสมกับนมนึ่งและช็อกโกแลตนุ่มนวล ราดด้วยวิปครีมเพื่อความอร่อย
C10,coffee,Latte,ลาเต้,拿铁,ラテ,70,35,150,"Espresso, Steamed Milk, Milk Foam","Rich espresso blended with steamed milk, topped with velvety foam for a creamy, comforting experience. Perfect for any time!",เอสเพรสโซ่เข้มข้นผสมกับนมนึ่ง ราดด้วยโฟมนุ่มนวลเพื่อประสบการณ์ครีมที่ปลอบโยน เหมาะสําหรับทุกเวลา!
C11,coffee,Iced Latte,ลาเต้เย็น,冰拿铁,アイスラテ,60,28,120 calories,"Iced Coffee, Milk, Ice, Sweetener","Chilled espresso blended with creamy milk and ice, topped with a hint of sweetness for a refreshing pick-me-up.",เอสเพรสโซ่แช่เย็นผสมกับครีมนมและน้ําแข็ง ราดด้วยความหวานเล็กน้อยเพื่อความสดชื่น
C12,coffee,Iced Americano,อเมริกาโน่เย็น,冰美式咖啡,アイスアメリカーノ,45,18,5 calories,"Iced Americano,Espresso,Cold Water,Ice","Bold espresso blended with chilled water and ice, delivering a refreshing, rich coffee experience perfect for warm days.",เอสเปรสโซเข้มข้นผสมกับน้ําเย็นและน้ําแข็ง มอบประสบการณ์กาแฟที่สดชื่นและเข้มข้น เหมาะสําหรับวันที่อากาศอบอุ่น
C13,coffee,Nitro Cold brew,ไนโตรโคลด์บรูว์,氮气冷萃咖啡,ナイトロコールドブリュー,100,35,5 calories,"Nitro Cold Brew, Cold Brew Coffee, Nitrogen Gas, Ice","Smooth, creamy Nitro Cold Brew infused with nitrogen for a rich, velvety texture and bold coffee flavor. Perfectly refreshing!",ไนโตร โคลด์ บรูว์ เนื้อเนียนนุ่ม ผสมไนโตรเจน เพื่อให้ได้เนื้อสัมผัสที่เข้มข้น นุ่มนวล และรสชาติกาแฟเข้มข้น สดชื่นอย่างสมบูรณ์แบบ!
C14,coffee,Mocha Cold Brew,มอคค่าโคลด์บรูว์,摩卡冷萃咖啡,モカコールドブリュー,165,55,150 calories,"Mocha Cold Brew, Cold Brew Coffee, Chocolate Syrup, Milk, Whipped Cream","Rich cold brew coffee blended with velvety chocolate and a hint of cream, served over ice for a refreshing treat.",กาแฟสกัดเย็นเข้มข้นผสมกับช็อกโกแลตนุ่มนวลและครีมเล็กน้อยเสิร์ฟบนน้ําแข็งเพื่อความสดชื่น
S12,smoothie,Watermelon Smoothie,สมูทตี้แตงโม,西瓜奶昔,スイカスムージー,75,39,Approximately 150 calories.,"Watermelon, Yogurt, Honey, Lime Juice","Refreshing watermelon smoothie blended with fresh fruit, a hint of mint, and a splash of lime for a summer delight.",สมูทตี้แตงโมสดชื่นผสมกับผลไม้สด สะระแหน่เล็กน้อย และมะนาวเล็กน้อยเพื่อความสุขในฤดูร้อน
S13,smoothie,Kiwi Smoothie,สมูทตี้กีวี,奇异果奶昔,キウイスムージー,90,48,250 calories,"Kiwi, Banana, Yogurt, Honey","Refreshing kiwi smoothie blended with creamy yogurt, honey, and a hint of mint for a tropical twist.",สมูทตี้กีวีสดชื่นผสมกับครีมโยเกิร์ต น้ําผึ้ง และสะระแหน่เล็กน้อยเพื่อกลิ่นท้อเขตร้อน
S14,smoothie,Mango Smoothie,มะม่วงสมูทตี้,芒果奶昔,マンゴースムージー,90,45,Approximately 200 calories.,"Mango, Yogurt, Honey, Ice","Refreshing mango smoothie blended with ripe mangoes, creamy yogurt, and a hint of honey for a tropical delight.",สมูทตี้มะม่วงสดชื่นผสมกับมะม่วงสุก โยเกิร์ตครีม และน้ําผึ้งเล็กน้อยเพื่อความสุขในเขตร้อน
S15,smoothie,Strawberry Smoothie,สมูทตี้สตรอว์เบอร์รี,草莓奶昔,ストロベリースムージー,85,41,200,"Strawberries, Yogurt, Honey, Milk","Refreshing strawberry smoothie blended with ripe strawberries, creamy yogurt, and a hint of honey for a delightful treat.",สมูทตี้สตรอเบอร์รี่สดชื่นผสมกับสตรอเบอร์รี่สุก โยเกิร์ตครีม และน้ําผึ้งเล็กน้อยเพื่อการรักษาที่น่ารื่นรมย์
T16,tea,Black Tea,ชาดำ,红茶,紅茶,45,18,2 calories,"Black Tea, Water, Sugar, Milk","Rich and robust black tea, brewed to perfection, offering a bold flavor with a smooth finish. Perfect for any time!",ชาดําเข้มข้นและเข้มข้น ชงให้สมบูรณ์แบบ ให้รสชาติเข้มข้นพร้อมผิวเรียบเนียน เหมาะสําหรับทุกเวลา!
T17,tea,Thai Tea,ชาไทย,泰式奶茶,タイティー,70,29,120 calories,"Sugar, Black tea, Condensed milk, Evaporated milk","Rich, creamy Thai tea infused with spices, served hot or iced for a refreshing, aromatic experience.",ชาไทยครีมเข้มข้นผสมเครื่องเทศเสิร์ฟร้อนหรือเย็นเพื่อประสบการณ์ที่สดชื่นและมีกลิ่นหอม
T18,tea,Bubble Tea,ชานมไข่มุก,珍珠奶茶,タピオカティー,70,30,300-500 calories (varies by ingredients and size),"Tapioca pearls, Milk, Tea, Sweetener","Delight in our refreshing bubble tea, featuring chewy tapioca pearls and a variety of flavors, perfect for any craving!",เพลิดเพลินไปกับชานมไข่มุกสดชื่นที่มีไข่มุกมันสําปะหลังเคี้ยวหนึบและรสชาติที่หลากหลาย เหมาะสําหรับทุกความอยาก!
T19,tea,Green Tea,ชาเขียว,绿茶,緑茶,65,26,2 calories,"Green Tea, Water, Honey, Lemon","Refreshing green tea, brewed from premium leaves, rich in antioxidants and perfect for a calming experience. Enjoy hot or iced!",ชาเขียวสดชื่น ชงจากใบพรีเมี่ยม อุดมไปด้วยสารต้านอนุมูลอิสระ และเหมาะสําหรับประสบการณ์ที่สงบเงียบ เพลิดเพลินกับร้อนหรือเย็น!
T20,tea,Jasmine Tea,ชามะลิ,茉莉花茶,ジャスミン茶,55,22,2 calories,"Jasmine tea, green tea leaves, jasmine flowers, water","Delicate jasmine tea infused with fragrant blossoms, offering a soothing and aromatic experience in every sip. Perfectly refreshing!",ชามะลิเนื้อละเอียดที่ผสมผสานกับดอกไม้หอมมอบประสบการณ์ที่ผ่อนคลายและมีกลิ่นหอมในทุกจิบ สดชื่นอย่างสมบูรณ์แบบ!
T21,tea,Yuzu Tea,ชาโยซุ,柚子茶,柚子茶,70,29,50 calories,"Yuzu, Honey, Water, Sugar","Refreshing yuzu tea, a citrus blend of tangy yuzu fruit and soothing herbal notes, perfect for any time of day.",ชายูซุสดชื่น ส่วนผสมของส้มของผลยูซุรสเปรี้ยวและกลิ่นสมุนไพรที่ผ่อนคลาย เหมาะสําหรับทุกช่วงเวลาของวัน
T98,tea,Nitro Black Tea Lemonade,น้ำชานิโตรดำมะนาว,氮气黑茶柠檬水,ニトロブラックティーレモネード,120,55,100 calories,"Nitro Black Tea, Lemonade, Simple Syrup, Lemon Slices","Refreshing nitro-infused black tea lemonade, combining bold tea flavors with zesty lemon for a smooth, effervescent experience.",น้ํามะนาวชาดําผสมไนโตรที่สดชื่น ผสมผสานรสชาติชาเข้มข้นเข้ากับมะนาวรสเข้มข้นเพื่อประสบการณ์ที่นุ่มนวลฟู่
T99,tea,Lemon Tea,ชาเลมอน,柠檬茶,レモンティー,70,30,30 calories,"Lemon, Tea, Sugar, Water","Refreshing lemon tea, brewed with fresh lemons and a hint of honey, perfect for a revitalizing pick-me-up.",ชามะนาวสดชื่น ชงด้วยมะนาวสดและน้ําผึ้งเล็กน้อย เหมาะสําหรับการฟื้นฟู
C99,coffee,Espresso Con Panna,เอสเพรสโซ่คอนปานนา,意式浓缩咖啡加奶油,エスプレッソ・コン・パンナ,110,45,80 calories,"Espresso, Whipped Cream, Sugar","Espresso Con Panna: Rich espresso topped with a dollop of whipped cream, creating a delightful balance of bold and creamy flavors.",เอสเพรสโซ่ คอน แพนนา: เอสเพรสโซ่เข้มข้นราดด้วยวิปครีมเล็กน้อย สร้างความสมดุลที่น่ารื่นรมย์ของรสชาติเข้มข้นและครีม
